"","Term","Ont","N","DE","P.DE"
"GO:0022832","voltage-gated channel activity","MF",197,8,0.000000200134138952473
"GO:0005244","voltage-gated ion channel activity","MF",197,8,0.000000200134138952473
"GO:0022843","voltage-gated cation channel activity","MF",142,7,0.000000329592347691464
"GO:0022839","ion gated channel activity","MF",334,8,0.0000103185796430703
"GO:0022836","gated channel activity","MF",343,8,0.000012509980883745
"GO:0005245","voltage-gated calcium channel activity","MF",48,4,0.0000161634062461814
"GO:0022890","inorganic cation transmembrane transporter activity","MF",594,10,0.0000165772612156432
